form_yemen_desc;For too long the fertile lands of Yemen have suffered in the hands of incompetent dynasties intent only on plundering her treasures. We must unite these lands so that they can once again prosper under an able ruler.;Pendant trop longtemps, les terres fertiles du Yémen ont souffert entre les mains de dynasties incompétentes qui ne voulaient que piller ses trésors. Nous devons unir ces terres pour qu'elles puissent à nouveau prospérer sous la direction d'un souverain habile.;Zu lange haben die fruchtbaren Länder des Jemen in den Händen inkompetenter Dynastien gelitten, die nur darauf aus waren, ihre Schätze zu plündern. Wir müssen diese Länder vereinen, damit sie wieder unter einem fähigen Herrscher leben können.;Zbyt d³ugo ¿yzne ziemie Jemenu ucierpia³y w rêkach niekompetentnych dynastii, zamierzaj¹cych jedynie ograbiæ jej skarby. Musimy zjednoczyæ te ziemie, aby mog³y znów siê rozwijaæ pod sprawnym w³adc¹.;Durante demasiado tiempo, las fértiles tierras de Yemen han sufrido en manos de dinastías incompetentes con la única intención de saquear sus tesoros. Debemos unir estas tierras para que puedan prosperar nuevamente bajo una gobernante capaz.;Per troppo tempo le terre fertili dello Yemen hanno sofferto nelle mani di dinastie incompetenti intente solo a saccheggiare i suoi tesori. Dobbiamo unire queste terre in modo che possano prosperare di nuovo sotto un sovrano abile.;Túl sokáig a jemeni termékeny földek szenvedtek olyan inkompetens dinasztiák kezében, amelyek csak a kincseit rabolják. Egyesítsük ezeket a földeket, hogy újra képesek legyünk sikeres uralkodók alatt.;Ji pøíliš dlouho plodné zemì Jemenu utrpìly v rukou nekompetentních dynastií, které se snaily jen vydìsit své poklady. Musíme sjednotit tyto zemì, aby se jim podaøilo opìt prosadit pod schopnım vládcem.;Túl sokáig a jemeni termékeny földek szenvedtek olyan inkompetens dinasztiák kezében, amelyek csak a kincseit rabolják. Egyesítsük ezeket a földeket, hogy újra képesek legyünk sikeres uralkodók alatt.;Te lang hebben de vruchtbare landen van Jemen geleden in de handen van incompetente dynastieën die alleen van plan zijn haar schatten te plunderen. We moeten deze landen verenigen zodat ze opnieuw kunnen gedijen onder een bekwame heerser.;Por muito tempo, as terras férteis do Iêmen sofreram nas mãos de dinastias incompetentes que pretendiam saquear seus tesouros. Precisamos unir essas terras para que elas possam novamente prosperar sob um governante capaz.;Ñëèøêîì äîëãî ïëîäîğîäíûå çåìëè Éåìåíà ïîñòğàäàëè â ğóêàõ íåêîìïåòåíòíûõ äèíàñòèé, ïğåäíàçíà÷åííûõ òîëüêî äëÿ ğàçãğàáëåíèÿ åå ñîêğîâèù. Ìû äîëæíû îáúåäèíèòü ıòè çåìëè, ÷òîáû îíè ìîãëè ñíîâà ïğîöâåòàòü ïîä óìåëûì ïğàâèòåëåì.;Liian kauan Jemenin hedelmälliset maat ovat kärsineet epäpätevien dynastioiden käsissä, jotka ovat vain aarteiden ryöstelyä. Meidän on yhdistettävä nämä maat niin, että he voivat jälleen menestyä kykenevän hallitsijan alla.;x
form_nepal_title;The Kingdom of Nepal;Le Royaume du Népal;Das Königreich Nepal;Królestwo Nepalu;El Reino de Nepal;Il regno del Nepal;Nepáli Királyság;Nepálské království;Nepáli Királyság;Het koninkrijk Nepal;O Reino do Nepal;Êîğîëåâñòâî Íåïàë;Nepalin kuningaskunta;x
form_nepal_desc;The home region of the Buddha should no longer fear war and instability, for it has been united by a migthy and strong rulership.;La région natale du Bouddha ne devrait plus craindre la guerre et l'instabilité, car elle a été unie par une puissante et puissante puissance.;Die Heimatregion des Buddha sollte Krieg und Instabilität nicht länger fürchten, denn sie wurde durch eine milde und starke Herrschaft vereint.;Rodzimy region Buddy nie powinien ju¿ obawiaæ siê wojny i niestabilnoœci, poniewa¿ zosta³ zjednoczony przez migrenê i silne rz¹dy.;La región de origen del Buda ya no debe temer a la guerra y la inestabilidad, ya que ha estado unida por una gobernación fuerte y migratoria.;La regione natale del Buddha non dovrebbe più temere la guerra e l'instabilità, perché è stata unita da un governo forte e mellifluo.;A Buddha lakóhelye többé nem szabad félnie a háborútól és az instabilitástól, mert egy könyörtelen és erõs uralkodás egyesült.;Domovská oblast Buddhy by se u nemìla bát války a nestability, nebo byla sjednocena bohatou a silnou vládou.;A Buddha lakóhelye többé nem szabad félnie a háborútól és az instabilitástól, mert egy könyörtelen és erõs uralkodás egyesült.;De thuisregio van de Boeddha zou niet langer oorlog en instabiliteit moeten vrezen, want het is verenigd door een migthy en een sterke heerschappij.;A região natal do Buda não deve mais temer a guerra e a instabilidade, pois foi unida por um governo poderoso e forte.;Äîìàøíèé ğåãèîí Áóääû áîëüøå íå äîëæåí áîÿòüñÿ âîéíû è íåñòàáèëüíîñòè, ïîñêîëüêó åå îáúåäèíÿåò ìèãğèğóşùàÿ è ñèëüíàÿ âëàñòü.;Buddhan kotiseutu ei enää pelkää sotaa ja epävakautta, sillä se on yhdistynyt vaeltava ja vahva hallitsija.;x
form_persia_title;Form the Persian Empire;Former l'Empire perse;Bilden Sie das Persische Reich;Zbuduj imperium perskie;Forma el Imperio Persa;Forma l'Impero Persiano;Formálja a Perzsa Birodalmat;Vytvoøení Perské Øíše;Formálja a Perzsa Birodalmat;Vorm het Perzische rijk;Forme o Império Persa;Ôîğìèğóéòå Ïåğñèäñêóş èìïåğèş;Muodosta Persian valtakunta;x
form_persia_desc;The Empire who was subjugated by Alexander, who fought the Romans, and who fell to the Arabs, it should no longer fear such foreign domination, for a strong Emperor has been found!;L'Empire subjugué par Alexandre, qui a combattu les Romains et qui est tombé aux mains des Arabes, ne devrait plus craindre une telle domination étrangère, car un puissant Empereur a été trouvé!;Das Reich, das von Alexander unterworfen wurde, der die Römer bekämpfte, und der den Arabern fiel, sollte eine solche Fremdherrschaft nicht länger fürchten, denn ein starker Kaiser wurde gefunden!;Imperium, które zosta³o podbite przez Aleksandra, który walczy³ z Rzymianami, i które pad³o ofiar¹ Arabów, nie powinno ju¿ d³u¿ej obawiaæ siê takiej obcej dominacji, poniewa¿ znaleziono silnego Imperatora!;¡El Imperio que fue subyugado por Alejandro, que luchó contra los romanos y cayó en manos de los árabes, ya no debería temer a la dominación extranjera, ya que se ha encontrado un emperador fuerte!;L'Impero che fu soggiogato da Alessandro, che combatté i Romani e che cadde sotto gli arabi, non dovrebbe più temere una tale dominazione straniera, perché è stato trovato un forte Imperatore!;A birodalom, akit Sándor leigázott, aki a rómaiak ellen harcolt, és aki az arabokba esett, nem szabad többé félnie az ilyen idegen uralomtól, mert egy erõs császárt találtak!;Øíši, která podmanila Alexandr, která bojovala proti Øímanùm a která padla Arabùm, u by se nemìla bát takové cizí nadvlády, protoe byl nalezen silnı císaø!;A birodalom, akit Sándor leigázott, aki a rómaiak ellen harcolt, és aki az arabokba esett, nem szabad többé félnie az ilyen idegen uralomtól, mert egy erõs császárt találtak!;Het rijk dat werd onderworpen door Alexander, die tegen de Romeinen vocht, en die viel voor de Arabieren, het zou niet langer bang zijn voor een dergelijke buitenlandse overheersing, want er is een sterke keizer gevonden!;O Império que foi subjugado por Alexandre, que lutou contra os romanos, e que caiu para os árabes, não deveria mais temer tal dominação estrangeira, pois um forte imperador foi encontrado!;Èìïåğèÿ, êîòîğàÿ áûëà ïîä÷èíåíà Àëåêñàíäğó, êîòîğûé âîåâàë ñ ğèìëÿíàìè, è êîòîğûé óïàë íà àğàáîâ, áîëüøå íå äîëæåí áûë îïàñàòüñÿ òàêîãî èíîñòğàííîãî ãîñïîäñòâà, ïîòîìó ÷òî áûë íàéäåí ñèëüíûé Èìïåğàòîğ!;Imperiumi, joka Aleksanteri oli alistanut, joka taisteli roomalaisia vastaan ja joka kaatui arabeihin, ei enää pidä pelätä tällaista ulkomaista ylivaltaa, sillä vahva keisari on löydetty!;x
form_kurdistan_title;The Homeland of the Kurds;La patrie des Kurdes;Das Heimatland der Kurden;Ojczyzna Kurdów;La patria de los kurdos;La patria dei curdi;A kurdok hazája;Královská vlas;A kurdok hazája;Het thuisland van de Koerden;A pátria dos curdos;Ğîäèíà êóğäîâ;Kurdien kotimaa;x
form_kurdistan_desc;Sons of Corduene, it has come the time for our nation to fight together against the foreign Arabs and Persians who just think of us as their slaves.;Fils de Corduene, il est temps pour notre nation de se battre ensemble contre les Arabes et les Perses étrangers qui ne pensent qu'à nous comme leurs esclaves.;Söhne von Korduene, es ist die Zeit gekommen, dass unsere Nation gegen die fremden Araber und Perser, die uns einfach für ihre Sklaven halten, gemeinsam kämpfen muss.;Synowie Corduene, nadszed³ czas, aby nasz naród walczy³ razem przeciwko obcym Arabom i Persom, którzy uwa¿aj¹ nas za swoich niewolników.;Hijos de Corduene, ha llegado el momento de que nuestra nación luche en contra de los árabes y persas extranjeros que solo piensan en nosotros como sus esclavos.;Figli di Corduene, è giunto il momento per la nostra nazione di combattere insieme contro gli stranieri arabi e persiani che pensano solo a noi come ai loro schiavi.;A Corduene fiai, eljött az ideje annak, hogy nemzetünk együtt harcoljon az idegen arabok és persák ellen, akik csak rabszolgáikra gondolnak ránk.;Synové z Corduene, pøišlo èas, aby náš národ bojoval proti cizím Arabùm a Peršanùm, kteøí o nás povaují za své otroky.;A Corduene fiai, eljött az ideje annak, hogy nemzetünk együtt harcoljon az idegen arabok és persák ellen, akik csak rabszolgáikra gondolnak ránk.;Zonen van Corduene, het is de tijd gekomen dat onze natie samen vecht tegen de buitenlandse Arabieren en Perzen die ons gewoon als hun slaven beschouwen.;Filhos de Corduene, chegou a hora de nossa nação lutar juntos contra os árabes e persas estrangeiros que só pensam em nós como escravos.;Ñûíîâüÿ Êîğäóıíà, íàñòàëî âğåìÿ äëÿ íàøåé íàöèè ñğàæàòüñÿ âìåñòå ñ èíîñòğàííûìè àğàáàìè è ïåğñàìè, êîòîğûå ïğîñòî äóìàşò î íàñ êàê î ñâîèõ ğàáàõ.;Corduenen poikien, on tullut aika meidän kansallemme taistella yhdessä ulkomaisten arabien ja persialaisten kanssa, jotka ajattelevat meitä vain orjina.;x
EVTNAME450008;The Transcaucasian Realms;Les royaumes transcaucasiens;Die transkaukasischen Reiche;Krainy Zakaukaskie;Los reinos de Transcaucasian;I regni transcaucasici;A Transcaucasian Realms;Zakázané království;A Transcaucasian Realms;De Transkaucasian rijken;Os Reinos Transcaucasianos;Çàêàâêàçñêèå öàğñòâà;Transkaukasian Realms;x
EVTDESC450008;After centuries of feudal fight amongst our neighbours, $COUNTRY$ finally managed to unite their kin and they are now able to be recognized from the world's powers.;Après des siècles de lutte féodale entre nos voisins, $COUNTRY$ a finalement réussi à unir leurs parents et ils peuvent maintenant être reconnus par les puissances du monde.;Nach Jahrhunderten des feudalen Kampfes zwischen unseren Nachbarn gelang $COUNTRY$ endlich, ihre Verwandten zu vereinen, und sie sind nun in der Lage, von den Mächten der Welt anerkannt zu werden.;Po stuleciach feudalnej walki pomiêdzy naszymi s¹siadami, $COUNTRY$ w koñcu uda³o siê zjednoczyæ swoich krewnych i teraz mog¹ byæ rozpoznawani ze œwiatowych mocy.;Después de siglos de lucha feudal entre nuestros vecinos, $COUNTRY$ finalmente logró unir a sus parientes y ahora pueden ser reconocidos por los poderes del mundo.;Dopo secoli di lotte feudali tra i nostri vicini, $COUNTRY$ finalmente è riuscito a unire i loro parenti e ora sono in grado di essere riconosciuti dai poteri del mondo.;A szomszédaink évszázados feudális küzdelme után a $COUNTRY$ végül sikerült egyesülniük rokonainkkal, és most már képesek vagyunk felismerni a világ hatalmából.;Po staletích feudálního boje mezi našimi sousedy se $COUNTRY$ koneènì podaøilo sjednotit své pøíbuzné a nyní jsou schopni rozpoznat svìtové mocnosti.;A szomszédaink évszázados feudális küzdelme után a $COUNTRY$ végül sikerült egyesülniük rokonainkkal, és most már képesek vagyunk felismerni a világ hatalmából.;Na eeuwen feodale strijd onder onze buren, is $COUNTRY$ er eindelijk in geslaagd om hun verwanten te verenigen en ze kunnen nu worden herkend door de machten van de wereld.;Depois de séculos de luta feudal entre os nossos vizinhos, o $COUNTRY$ finalmente conseguiu unir seus parentes e agora eles podem ser reconhecidos pelas potências mundiais.;Ïîñëå ñòîëåòèé ôåîäàëüíîé áîğüáû ñğåäè íàøèõ ñîñåäåé, $COUNTRY$, íàêîíåö, óäàëîñü îáúåäèíèòü ñâîèõ ğîäñòâåííèêîâ, è òåïåğü îíè ìîãóò áûòü ïğèçíàíû èç ìèğîâûõ äåğæàâ.;Sen jälkeen, kun naapurimaissamme oli vuosisatojen feodaalinen taistelu, $COUNTRY$ vihdoin onnistui yhdistämään sukulaisensa ja heidät voidaan nyt tunnustaa maailman voimasta.;x
EVTOPTA450008;We’re the Kings of Georgia.;Nous sommes les rois de Géorgie.;Wir sind die Könige von Georgia.;Jesteœmy królami Gruzji.;Somos los Reyes de Georgia.;Siamo i re della Georgia.;Grúzia királyai vagyunk.;My jsme Králové Gruzie.;Grúzia királyai vagyunk.;Wij zijn de koningen van Georgië.;Nós somos os reis da Geórgia.;Ìû - êîğîëè Ãğóçèè.;Olemme Georgian kuninkaita.;x
EVTOPTB450008;We’re the Kings of Armenia.;Nous sommes les rois d'Arménie.;Wir sind die Könige von Armenien.;Jesteœmy królami Armenii.;Somos los Reyes de Armenia.;Siamo i re dell'Armenia.;Örményország királyai vagyunk.;Jsme králové Arménie.;Örményország királyai vagyunk.;Wij zijn de koningen van Armenië.;Nós somos os reis da Armênia.;Ìû - êîğîëè Àğìåíèè.;Olemme Armenian kuninkaita.;x
EVTOPTC450008;We’re the Kings of Azerbaijan.;Nous sommes les rois d'Azerbaïdjan.;Wir sind die Könige von Aserbaidschan.;Jesteœmy królami Azerbejd¿anu.;Somos los Reyes de Azerbaiyán.;Siamo i re dell'Azerbaigian.;Azerbajdzsán királyai vagyunk.;Jsme králové Ázerbájdánu.;Azerbajdzsán királyai vagyunk.;Wij zijn de koningen van Azerbeidzjan.;Nós somos os reis do Azerbaijão.;Ìû – êîğîëè Àçåğáàéäæàíà.;Olemme Azerbaidanin kuninkaita.;x
EVTNAME450009;Secularization of $COUNTRY$;Secularisation de $COUNTRY$;Säkularisierung von $COUNTRY$;Sekularyzacja $COUNTRY$;Secularización de $COUNTRY$;Secolarizzazione di $COUNTRY$;A $COUNTRY$ szekularizációja;Sekularizace $COUNTRY$;A $COUNTRY$ szekularizációja;Secularisatie van $COUNTRY$;Secularização de $COUNTRY$;Ñåêóëÿğèçàöèÿ $COUNTRY$;$COUNTRY$ sekularisoituminen;x
EVTDESC450009;The Era of Religious Fight belongs now to the past and our people are tired of all this backwardness caused by the Clergy. It’s time to suit ourselves as an actual country.;L'ère de la lutte religieuse appartient maintenant au passé et notre peuple est fatigué de tout ce retard causé par le clergé. Il est temps de nous adapter comme un pays réel.;Die Ära des religiösen Kampfes gehört jetzt der Vergangenheit an und unsere Leute sind von all dieser Rückständigkeit, die durch den Klerus verursacht wurde, müde. Es ist Zeit, uns als ein echtes Land zu betrachten.;Era religijnej walki nale¿y ju¿ do przesz³oœci, a nasz lud jest zmêczony tym zacofaniem spowodowanym przez duchowieñstwo. Nadszed³ czas, aby dopasowaæ siê do rzeczywistego kraju.;La era de la lucha religiosa pertenece ahora al pasado y nuestra gente está cansada de todo este atraso causado por el clero. Es hora de adaptarse a nosotros mismos como un país real.;L'era della lotta religiosa appartiene ora al passato e il nostro popolo è stanco di tutta questa arretratezza causata dal clero. È il momento di adattarsi a noi stessi come un vero paese.;A vallási küzdelem korszaka már a múlté, és népünk elfáradt a Clergy által okozott minden elmaradottságtól. Itt az ideje, hogy valódi országként alkalmazzuk magunkat.;Era náboenské bitvy nyní patøí k minulosti a naši lidé jsou unaveni touto zátìí zpùsobenou duchovenstvem. Je na èase, abychom vyhovovali sobì jako skuteèné zemi.;A vallási küzdelem korszaka már a múlté, és népünk elfáradt a Clergy által okozott minden elmaradottságtól. Itt az ideje, hogy valódi országként alkalmazzuk magunkat.;Het tijdperk van religieuze strijd behoort nu tot het verleden en onze mensen zijn moe van al deze achterstand veroorzaakt door de geestelijken. Het is tijd om onszelf als een echt land te passen.;A Era da Luta Religiosa pertence agora ao passado e nosso povo está cansado de todo esse atraso causado pelo Clero. É hora de nos adequarmos como um país real.;İïîõà ğåëèãèîçíîé áîğüáû òåïåğü îòíîñèòñÿ ê ïğîøëîìó, è íàøè ëşäè óñòàëè îò âñåé ıòîé îòñòàëîñòè, âûçâàííîé äóõîâåíñòâîì. Ïğèøëî âğåìÿ óñòğîèòüñÿ êàê íàñòîÿùàÿ ñòğàíà.;Uskonnollisen taistelun aikakausi kuuluu nyt menneisyyteen ja kansamme ovat kyllästyneet kaikesta tämän papiston aiheuttamasta takapajuisuudesta. On aika sovittaa itsellemme todellinen maa.;x
EVTOPTA450009;Deus Vult, sed Melitenses non.;Deus Vult, sed Melitenses non.;Deus Vult, sed Melitenses non.;Deus Vult, sed Melitenses non.;Deus Vult, sed Melitenses non.;Deus Vult, sed Melitenses non.;Deus Vult, sed Melitenses non.;Deus Vult, sed Melitenses non.;Deus Vult, sed Melitenses non.;Deus Vult, sed Melitenses non.;Deus Vult, sed Melitenses non.;Äıóñ Âóëò, ñıä Ìıëèòıíñıñ íîí.;Deus Vult, sed Melitenses non.;x
EVTOPTB450009;Deus Vult, sed Theodisces non.;Deus Vult, sed Theodisces non.;Deus Vult, sed Theodisces non.;Deus Vult, sed Theodisces non.;Deus Vult, sed Theodisces non.;Deus Vult, sed Theodisces non.;Deus Vult, sed Theodisces non.;Deus Vult, sed Theodisces non.;Deus Vult, sed Theodisces non.;Deus Vult, sed Theodisces non.;Deus Vult, sed Theodisces non.;Äıóñ Âóëò, ñıä Ôıîäèñêıñ íîí.;Deus Vult, sed Theodisces non.;x
EVTOPTC450009;Deus Vult, sed Lettones non.;Deus Vult, sed Lettones non.;Deus Vult, sed Lettones non.;Deus Vult, sed Lettones non.;Deus Vult, sed Lettones non.;Deus Vult, sed Lettones non.;Deus Vult, sed Lettones non.;Deus Vult, sed Lettones non.;Deus Vult, sed Lettones non.;Deus Vult, sed Lettones non.;Deus Vult, sed Lettones non.;Äıóñ Âóëò, ñıä Ëåòòîíıñ íîí.;Deus Vult, sed Lettones non.;x
EVTOPTD450009;Deus Vult, sed $COUNTRY$ non.;Deus Vult, sed $COUNTRY$ non.;Deus Vult, sed $COUNTRY$ non.;Deus Vult, sed $COUNTRY$ non.;Deus Vult, sed $COUNTRY$ non.;Deus Vult, sed $COUNTRY$ non.;Deus Vult, sed $COUNTRY$ non.;Deus Vult, sed $COUNTRY$ non.;Deus Vult, sed $COUNTRY$ non.;Deus Vult, sed $COUNTRY$ non.;Deus Vult, sed $COUNTRY$ non.;Äıóñ Âóëò, ñıä $COUNTRY$ íîí.;Deus Vult, sed $COUNTRY$ non.;x
form_burma_title;$COUNTRY$, kings of the Burmese;$COUNTRY$, rois des Birmans;$COUNTRY$, Könige der Burmesen;$COUNTRY$, królowie Birmy;$COUNTRY$, reyes de los birmanos;$COUNTRY$, re dei birmani;$COUNTRY$, a burmai királyok;$COUNTRY$, králové barmského;$COUNTRY$, a burmai királyok;$COUNTRY$, kings of the Burmese;$COUNTRY$, reis do birmanês;$COUNTRY$, êîğîëè áèğìàíñêèõ;$COUNTRY$, Burman kuninkaat;x
form_burma_desc;For centuries long, the Burmese folk has been shattered by feudal fights but under the rulership of $COUNTRY$ they finally managed to come together under a flag, like the Westerners do.;Pendant des siècles, le peuple birman a été brisé par les combats féodaux mais sous la domination de $COUNTRY$, ils ont finalement réussi à se réunir sous un drapeau, comme le font les Occidentaux.;Seit Jahrhunderten wird das burmesische Volk durch Feudalkriege zerstört, aber unter der Herrschaft von $COUNTRY$ haben sie es schließlich geschafft, unter einer Flagge zusammen zu kommen, wie es die Westler tun.;Przez stulecia birmañski lud by³ niszczony przez feudalne bójki, ale pod rz¹dami $COUNTRY$ w koñcu uda³o im siê zebraæ pod flag¹, tak jak robi¹ to ludzie Zachodu.;Durante siglos, el pueblo birmano se ha visto destrozado por las luchas feudales, pero bajo la gobernación de $COUNTRY$ finalmente lograron unirse bajo una bandera, como lo hacen los occidentales.;Per secoli, il popolo birmano è stato distrutto da lotte feudali ma sotto il dominio di $COUNTRY$ è finalmente riuscito a riunirsi sotto una bandiera, come fanno gli occidentali.;A burmai népet évszázadok óta összetörték a feudális harcok, de a $COUNTRY$ uralkodása alatt végül sikerült egy zászló alatt összejönniük, mint a nyugatiak.;Po celá staletí byly barmské lidi znièeny feudálními boji, ale pod vládou $COUNTRY$ se koneènì podaøilo sejít pod vlajkou, stejnì jako západní obyvatelé.;A burmai népet évszázadok óta összetörték a feudális harcok, de a $COUNTRY$ uralkodása alatt végül sikerült egy zászló alatt összejönniük, mint a nyugatiak.;Eeuwenlang werd het Birmese volk verwoest door feodale gevechten, maar onder de heerschappij van $COUNTRY$ slaagden ze er uiteindelijk in om samen te komen onder een vlag, zoals de westerlingen doen.;Durante séculos, o povo birmanês foi abalado por lutas feudais, mas sob o governo de $COUNTRY$ eles finalmente conseguiram se unir sob uma bandeira, como fazem os ocidentais.;Íà ïğîòÿæåíèè âåêîâ áèğìàíñêèé íàğîä áûë ğàçğóøåí ôåîäàëüíûìè áîÿìè, íî ïîä âëàñòüş $COUNTRY$ èì íàêîíåö óäàëîñü ñîáğàòüñÿ ïîä ôëàãîì, êàê ıòî äåëàşò æèòåëè Çàïàäà.;Vuosisatojen ajan burmaialaiset ovat rikkoneet feodaaliset taistelut, mutta $COUNTRY$ hallitsijat pääsivät lopulta yhteen lipun alla, kuten länsimaalaiset.;x
form_shan_title;$COUNTRY$, heirs of the Shan;$COUNTRY$, héritiers du Shan;$COUNTRY$, Erben des Shan;$COUNTRY$, spadkobiercy Shanu;$COUNTRY$, herederos del Shan;$COUNTRY$, eredi dello Shan;$COUNTRY$, a Shan örökösei;$COUNTRY$, dìdicové Šan;$COUNTRY$, a Shan örökösei;$COUNTRY$, erfgenamen van de Shan;$COUNTRY$, herdeiros do Shan;$COUNTRY$, íàñëåäíèêè Øàíÿ;$COUNTRY$, Shanin perilliset;x
form_shan_desc;For centuries long, the Shan folk has been shattered by feudal fights but under the rulership of $COUNTRY$ they finally managed to come together under a flag, like the Westerners do.;Pendant des siècles, le peuple Shan a été brisé par des combats féodaux, mais sous la domination de $COUNTRY$, ils ont finalement réussi à se réunir sous un drapeau, comme le font les Occidentaux.;Seit Jahrhunderten wird das Shan Volk durch Feudalkriege zerstört, aber unter der Herrschaft von $COUNTRY$ haben sie es schließlich geschafft, unter einer Flagge zusammen zu kommen, wie es die Westler tun.;Przez stulecia lud Shan by³ niszczony przez feudalne bójki, ale pod rz¹dami $COUNTRY$ uda³o im siê wreszcie zebraæ pod flag¹, tak jak robi¹ to ludzie Zachodu.;Durante siglos, la gente shan se ha visto destrozada por las luchas feudales, pero bajo la gobernación de $COUNTRY$ finalmente lograron unirse bajo una bandera, como lo hacen los occidentales.;Per secoli, il popolo Shan è stato distrutto da lotte feudali ma sotto il dominio di $COUNTRY$ è finalmente riuscito a riunirsi sotto una bandiera, come fanno gli occidentali.;Évszázadokon keresztül a Shan népet összetörték a feudális harcok, de a $COUNTRY$ uralkodása alatt végül sikerült egy zászló alatt összejönniük, mint a nyugatiak.;Po celá staletí se lidi Šan rozpadli feudálními boji, ale pod vedením zemì $COUNTRY$ se koneènì podaøilo shromádit se pod vlajkou, stejnì jako západní obyvatelé.;Évszázadokon keresztül a Shan népet összetörték a feudális harcok, de a $COUNTRY$ uralkodása alatt végül sikerült egy zászló alatt összejönniük, mint a nyugatiak.;Al eeuwenlang is het Shan-volk verwoest door feodale gevechten, maar onder de heerschappij van $COUNTRY$ slaagden ze er uiteindelijk in om samen te komen onder een vlag, zoals de westerlingen dat doen.;Por séculos, o povo Shan foi destruído por lutas feudais, mas sob o governo de $COUNTRY$ eles finalmente conseguiram se unir sob uma bandeira, como fazem os ocidentais.;Íà ïğîòÿæåíèè âåêîâ íàğîä Øàíÿ áûë ğàçğóøåí ôåîäàëüíûìè áîÿìè, íî ïîä óïğàâëåíèåì $COUNTRY$ èì íàêîíåö óäàëîñü ñîáğàòüñÿ ïîä ôëàãîì, êàê ıòî äåëàşò æèòåëè Çàïàäà.;Jo vuosisatoja kestävästi Shan-kansan on pilkannut feodaaliset taistelut, mutta $COUNTRY$ hallitsijat pääsivät lopulta yhteen lipun alla, kuten länsimaalaiset.;x
theocratic_rebels;Soldiers of God;Soldats de Dieu;Soldaten Gottes;¯o³nierze Boga;Soldados de Dios;Soldati di Dio;Isten Katona;Bojovníci Boí;Isten Katona;Soldaten van God;Soldados de Deus;Ñîëäàòû Áîãà;Jumalan Sotilaat;x
