KEY;ENGLISH;FRENCH;GERMAN;POLISH;SPANISH;ITALIAN;HUNGARIAN;CZECH;HUNGARIAN;DUTCH;PORTUGUESE;RUSSIAN;FINNISH;X
form_gallia_desc;After Julius Caesar in the first century BC, the Roman Empire held the region of Gaul for long time, even after the Crisis of the Third Century. A rump state of the Augustans, the Dukedom of Soissons, survived for enough of a time to give the Gallian lands a Roman identity that lasted until today, when a country can finally be formed.;Après Jules César au Ier siècle av. J.-C., l'Empire romain a longtemps tenu la région de la Gaule, même après la crise du troisième siècle. Un état croupion des Augustains, le Duché de Soissons, a survécu assez longtemps pour donner aux terres galloises une identité romaine qui a duré jusqu'à aujourd'hui, quand un pays peut enfin se former.;Nach Julius Caesar im ersten Jahrhundert v. Chr. hielt das Römische Reich die Region Gallien für lange Zeit, auch nach der Krise des Dritten Jahrhunderts. Ein Rumpfzustand der Augustaner, des Herzogtums von Soissons, blieb lange Zeit erhalten, um den Gallierländern eine römische Identität zu geben, die bis heute andauerte, als ein Land endlich gegründet werden konnte.;Po Juliuszu Cezarze w pierwszym wieku pne Imperium Rzymskie utrzymywa³o region Galii przez d³ugi czas, nawet po Kryzysie Trzeciego Wieku. Pozbawione rodu pañstwo Augustañczyków, Ksiêstwo Soissonów, przetrwa³o doœæ czasu, aby nadaæ ziemom galijskim rzymsk¹ to¿samoœæ, która trwa³a do dzisiaj, kiedy kraj mo¿e siê wreszcie ukszta³towaæ.;Después de Julio César en el siglo I aC, el Imperio Romano mantuvo la región de la Galia durante mucho tiempo, incluso después de la Crisis del siglo III. Un estado de grupa de los augustos, el ducado de Soissons, sobrevivió durante un tiempo suficiente para dar a las tierras de Gallia una identidad romana que duró hasta hoy, cuando finalmente se puede formar un país.;Dopo Giulio Cesare, nel I secolo a.C., l'impero romano mantenne la regione della Gallia per lungo tempo, anche dopo la crisi del terzo secolo. Uno stato di groppa degli Augustiani, il Ducato di Soissons, sopravvisse per un tempo sufficiente a dare alle terre gallesi un'identità romana che durò fino ad oggi, quando un paese può finalmente istituzionalizzarsi.;Julius Caesar után a Kr. E. I. században a Római Birodalom régóta tartotta a Gaul régióját, még a harmadik évszázad válsága után is. Az augusztusiak, a Soissons dukedusa túlélte elég idõre, hogy a galliai földeket egy olyan római identitásnak adják át, amely addig tartott egészen addig, amíg egy ország végül megalakul.;Po Juliu Caesara v prvním století pøed naším letopoètem øímské impérium po dlouhou dobu drelo oblast Galie, a to i po krizi tøetího století. Kultivovı stav Augustù, Dukedom Soissons, pøeil dost èasu, aby dal Gallianskım zemím øímskou identitu, která trvala a do dneška, kdy se nakonec mùe stát zemì.;Julius Caesar után a Kr. E. I. században a Római Birodalom régóta tartotta a Gaul régióját, még a harmadik évszázad válsága után is. Az augusztusiak, a Soissons dukedusa túlélte elég idõre, hogy a galliai földeket egy olyan római identitásnak adják át, amely addig tartott egészen addig, amíg egy ország végül megalakul.;Na Julius Caesar in de eerste eeuw voor Christus hield het Romeinse Rijk de regio Gallië lang vast, zelfs na de crisis van de derde eeuw. Een rompstaat van de Augustanen, het hertogdom Soissons, overleefde genoeg tijd om het Gallische land een Romeinse identiteit te geven die tot vandaag heeft geduurd, wanneer eindelijk een land kan worden gevormd.;Depois de Júlio César no primeiro século aC, o Império Romano manteve a região da Gália por muito tempo, mesmo após a crise do terceiro século. Um estado pobre dos Augustanos, o Ducado de Soissons, sobreviveu por tempo suficiente para dar às terras da Gália uma identidade romana que perdurou até hoje, quando um país pode finalmente ser formado.;Ïîñëå Şëèóñà Öåçàğÿ â ïåğâîì âåêå äî íàøåé ığû Ğèìñêàÿ èìïåğèÿ äîëãîå âğåìÿ äåğæàëà ğåãèîí Ãàëëèè, äàæå ïîñëå êğèçèñà òğåòüåãî âåêà. Êğóòîå ñîñòîÿíèå àâãóñòîâöåâ, ãåğöîã Ñóàññîíîâ, âûæèëî äîñòàòî÷íî äîëãî, ÷òîáû äàòü ãàëëüñêèì çåìëÿì ğèìñêóş èäåíòè÷íîñòü, êîòîğàÿ ïğîäîëæàëàñü äî ñåãîäíÿøíåãî äíÿ, êîãäà íàêîíåö ìîæíî ñôîğìèğîâàòü ñòğàíó.;Kun Julius Caesar oli ensimmäisellä vuosisadalla eKr., Rooman valtakunta säilytti Gaulin alueen pitkään myös kolmannen vuosisadan kriisin jälkeen. Augustinsin, Soissonsin Dukedom, selviytyi tarpeeksi aikaa antaa Gallian maille roomalainen identiteetti, joka kesti tähän päivään asti, jolloin maa voi lopulta muodostaa.;x
form_laessinia_title;The Provincia Læthinia;La Provincia Læthinia;Die Provincia Læthinia;Provincia Læthinia;La Provincia Læthinia;La Provincia Læthinia;A Provincia Læthinia;Provincia Læthinia;A Provincia Læthinia;De Provincia Læthinia;A Provincia Læthinia;Ïğîâèíöèÿ Ëıôèíèÿ;Provincia Læthinia;x
form_laessinia_desc;"The tricky border of the Danube didn't stop the Roman army founding cities in the Pannonian Basin. Roman identity spread ever since and today the gentes of these areas unite under their speech's version of Latins, the country of ""Läßinia""";"La frontière délicate du Danube n'a pas arrêté les villes fondatrices de l'armée romaine dans le bassin pannonien. L'identité romaine s'est répandue depuis et aujourd'hui les gentes de ces régions s'unissent sous la version de leur discours de Latins, le pays de ""Läßinia""";"Die knifflige Grenze der Donau hielt die römischen Armeestädte im Pannonischen Becken nicht auf. Die römische Identität verbreitete sich seither und heute vereinigen sich die Gentes dieser Gebiete unter ihrer Sprachversion von Latin, dem ""Läßinia""-Land.";"Trudna granica Dunaju nie powstrzyma³a rzymskich miast-armii w Basenie Panoñskim. Odt¹d rzymska to¿samoœæ rozprzestrzeni³a siê i dziœ rody tych terenów jednocz¹ siê pod wersj¹ ³aciñsk¹ Latins, kraju ""Läßinia""";"La complicada frontera del Danubio no detuvo al ejército romano al fundar ciudades en la cuenca de Panonia. La identidad romana se extendió desde entonces y hoy las gentes de estas áreas se unen bajo la versión de su discurso de los latinos, el país de ""Läßinia""";"Il difficile confine del Danubio non ha fermato l'esercito romano fondando città nel bacino della Pannonia. L'identità romana si è diffusa da allora e oggi le gentes di queste aree si uniscono sotto la parlata dei latini, il paese della ""Läßinia""";"A Duna bonyolult határán nem állt meg a római hadsereg alapító városai a Pannon-medencében. A római identitás azóta és napjaink óta terjedt el ezeknek a területeknek a lelkei a Latins, a ""Läßinia""";"Sloitá hranice Dunaje nezastavila øímskou armádu zakládající mìsta v Panonské pánvi. Øímská identita se od té doby rozšiøuje a dnes se genety tìchto oblastí spojují podle verze øeèi Latins, zemì ""Läßinia""";"A Duna bonyolult határán nem állt meg a római hadsereg alapító városai a Pannon-medencében. A római identitás azóta és napjaink óta terjedt el ezeknek a területeknek a lelkei a Latins, a ""Läßinia""";"De lastige grens van de Donau heeft het Romeinse leger niet belet steden in het Pannonische bekken op te richten. De Romeinse identiteit breidde zich sindsdien uit en vandaag verenigen de gentes van deze gebieden zich met hun versie van Latins, het land van ""Läßinia"".";"A fronteira complicada do Danúbio não impediu as cidades fundadoras do exército romano na Bacia da Panônia. A identidade romana se espalhou desde então e hoje as gentes dessas áreas se unem sob a versão de seu discurso dos latinos, o país de ""Läßinia""";"Òğóäíàÿ ãğàíèöà Äóíàÿ íå îñòàíîâèëà ñîçäàíèå ğèìñêèõ àğìåéñêèõ ãîğîäîâ â Ïàííîíñêîì áàññåéíå. Ğèìñêàÿ èäåíòè÷íîñòü ğàñïğîñòğàíèëàñü ñ òåõ ïîğ è ñåãîäíÿ ãåíû ıòèõ îáëàñòåé îáúåäèíÿşòñÿ ïî âåğñèè èõ ğå÷è ëàòèíÿí, ñòğàíû ""Ëıññèíèÿ"".";"Tonavan hankala raja ei pysäyttänyt Pannonian altaan perusvaltuuskuntia. Rooman identiteetti leviää siitä lähtien ja nykyään näiden alueiden gentes yhdistyvät niiden latinankielisten versioiden mukaan, ""Läßinia""";x
form_euskadi_title;Nafarroako Euskaldunak;Nafarroako Euskaldunak;Nafarroako Euskaldunak;Nafarroako Euskaldunak;Nafarroako Euskaldunak;Nafarroako Euskaldunak;Nafarroako Euskaldunak;Nafarroako Euskaldunak;Nafarroako Euskaldunak;Nafarroako Euskaldunak;Nafarroako Euskaldunak;Íàôàğğàêî İóñêàëäóíàê;Nafarroako Euskaldunak;x
form_euskadi_desc;The Kingdom of Navarre resisted centuries and centuries, but after the deposition of the King, the people started to admire the national states in the rest of Europe. Perhaps, the Basques as well should get a country, in name as well.;Le royaume de Navarre a résisté aux siècles, mais après la déposition du roi, le peuple a commencé à admirer les états nationaux dans le reste de l'Europe. Peut-être que les Basques devraient aussi avoir un pays, en nom.;Das Königreich von Navarra widerstand Jahrhunderte und Jahrhunderte, aber nach der Absetzung des Königs begann das Volk, die Nationalstaaten im Rest von Europa zu bewundern. Vielleicht sollten auch die Basken ein Land bekommen, auch im Namen.;Królestwo Nawarry opiera³o siê wiekom i stuleciom, ale po deportacji króla ludzie zaczêli podziwiaæ pañstwa narodowe w pozosta³ej czêœci Europy. Byæ mo¿e Baskowie równie¿ powinni otrzymaæ nazwê, równie¿ z nazwy.;El Reino de Navarra resistió siglos y siglos, pero después de la deposición del Rey, la gente comenzó a admirar los estados nacionales en el resto de Europa. Quizás, los vascos también deberían tener un país, también de nombre.;Il Regno di Navarra resistette a secoli e secoli, ma dopo la deposizione del Re, la gente iniziò ad ammirare gli stati nazionali nel resto d'Europa. Forse anche i baschi dovrebbero avere un paese, anche nel nome.;A Navarrai Királyság évszázadokkal és évszázadokkal szemben ellenállt, de a király lerakása után az emberek Európa többi országában kezdték csodálni a nemzeti államokat. Talán a baszkoknak is meg kell szerezniük egy országot, név szerint is.;Království Navarra odolalo staletím a staletím, ale po uloení krále lidé zaèali obdivovat národní státy ve zbytku Evropy. Moná by mìli baskici také dostat zemi, a to i v názvu.;A Navarrai Királyság évszázadokkal és évszázadokkal szemben ellenállt, de a király lerakása után az emberek Európa többi országában kezdték csodálni a nemzeti államokat. Talán a baszkoknak is meg kell szerezniük egy országot, név szerint is.;Het koninkrijk Navarra verzette zich eeuwen en eeuwen, maar na de afzetting van de koning begon het volk de nationale staten in de rest van Europa te bewonderen. Misschien moeten de Basken ook een land krijgen, ook in naam.;O reino de Navarra resistiu séculos e séculos, mas depois da deposição do rei, o povo começou a admirar os estados nacionais no resto da Europa. Talvez os bascos também tenham um país, também conhecido.;Êîğîëåâñòâî Íàâàğğû ñîïğîòèâëÿëîñü ñòîëåòèÿìè è ñòîëåòèÿìè, íî ïîñëå îòñòàâêè êîğîëÿ ëşäè ñòàëè âîñõèùàòüñÿ íàöèîíàëüíûìè ãîñóäàğñòâàìè â îñòàëüíîé Åâğîïå. Âîçìîæíî, áàñêè òàêæå äîëæíû ïîëó÷èòü ñòğàíó, ïî èìåíè.;Navarran kuningaskunta vastusti vuosisatoja ja vuosisatoja, mutta kuninkaan laskeutumisen jälkeen ihmiset alkoivat ihailla kansallisia valtioita muualla Euroopassa. Ehkä Baskien pitäisi saada myös maa, nimessään.;x
form_yemen_title;Unite Yemen;Unir le Yémen;Vereinigung von Jemen;Zjednocz siê z Jemenem;Unir a Yemen;Unire lo Iemen;Csatlakozz Jemenhez;Spojte Jemen;Csatlakozz Jemenhez;Verenig Jemen;Unite Iêmen;Îáúåäèíèòü Éåìåí;Yhdistä Jemen;x
form_yemen_desc;For too long the fertile lands of Yemen have suffered in the hands of incompetent dynasties intent only on plundering her treasures. We must unite these lands so that they can once again prosper under an able ruler.;Pendant trop longtemps, les terres fertiles du Yémen ont souffert entre les mains de dynasties incompétentes qui ne voulaient que piller ses trésors. Nous devons unir ces terres pour qu'elles puissent à nouveau prospérer sous la direction d'un souverain habile.;Zu lange haben die fruchtbaren Länder des Jemen in den Händen inkompetenter Dynastien gelitten, die nur darauf aus waren, ihre Schätze zu plündern. Wir müssen diese Länder vereinen, damit sie wieder unter einem fähigen Herrscher leben können.;Zbyt d³ugo ¿yzne ziemie Jemenu ucierpia³y w rêkach niekompetentnych dynastii, zamierzaj¹cych jedynie ograbiæ jej skarby. Musimy zjednoczyæ te ziemie, aby mog³y znów siê rozwijaæ pod sprawnym w³adc¹.;Durante demasiado tiempo, las fértiles tierras de Yemen han sufrido en manos de dinastías incompetentes con la única intención de saquear sus tesoros. Debemos unir estas tierras para que puedan prosperar nuevamente bajo una gobernante capaz.;Per troppo tempo le terre fertili dello Iemen hanno sofferto nelle mani di dinastie incompetenti intente solo a saccheggiare i suoi tesori. Dobbiamo unire queste terre in modo che possano prosperare di nuovo sotto un sovrano abile.;Túl sokáig a jemeni termékeny földek szenvedtek olyan inkompetens dinasztiák kezében, amelyek csak a kincseit rabolják. Egyesítsük ezeket a földeket, hogy újra képesek legyünk sikeres uralkodók alatt.;Ji pøíliš dlouho plodné zemì Jemenu utrpìly v rukou nekompetentních dynastií, které se snaily jen vydìsit své poklady. Musíme sjednotit tyto zemì, aby se jim podaøilo opìt prosadit pod schopnım vládcem.;Túl sokáig a jemeni termékeny földek szenvedtek olyan inkompetens dinasztiák kezében, amelyek csak a kincseit rabolják. Egyesítsük ezeket a földeket, hogy újra képesek legyünk sikeres uralkodók alatt.;Te lang hebben de vruchtbare landen van Jemen geleden in de handen van incompetente dynastieën die alleen van plan zijn haar schatten te plunderen. We moeten deze landen verenigen zodat ze opnieuw kunnen gedijen onder een bekwame heerser.;Por muito tempo, as terras férteis do Iêmen sofreram nas mãos de dinastias incompetentes que pretendiam saquear seus tesouros. Precisamos unir essas terras para que elas possam novamente prosperar sob um governante capaz.;Ñëèøêîì äîëãî ïëîäîğîäíûå çåìëè Éåìåíà ïîñòğàäàëè â ğóêàõ íåêîìïåòåíòíûõ äèíàñòèé, ïğåäíàçíà÷åííûõ òîëüêî äëÿ ğàçãğàáëåíèÿ åå ñîêğîâèù. Ìû äîëæíû îáúåäèíèòü ıòè çåìëè, ÷òîáû îíè ìîãëè ñíîâà ïğîöâåòàòü ïîä óìåëûì ïğàâèòåëåì.;Liian kauan Jemenin hedelmälliset maat ovat kärsineet epäpätevien dynastioiden käsissä, jotka ovat vain aarteiden ryöstelyä. Meidän on yhdistettävä nämä maat niin, että he voivat jälleen menestyä kykenevän hallitsijan alla.;x
form_nepal_title;The Kingdom of Nepal;Le Royaume du Népal;Das Königreich Nepal;Królestwo Nepalu;El Reino de Nepal;Il regno del Nepal;Nepáli Királyság;Nepálské království;Nepáli Királyság;Het koninkrijk Nepal;O Reino do Nepal;Êîğîëåâñòâî Íåïàë;Nepalin kuningaskunta;x
form_nepal_desc;The home region of the Buddha should no longer fear war and instability, for it has been united by a migthy and strong rulership.;La région natale du Bouddha ne devra plus craindre la guerre et l'instabilité, car elle a été unie par une puissante et puissante puissance.;Die Heimatregion des Buddha sollte Krieg und Instabilität nicht länger fürchten, denn sie wurde durch eine milde und starke Herrschaft vereint.;Rodzimy region Buddy nie powinien ju¿ obawiaæ siê wojny i niestabilnoœci, poniewa¿ zosta³ zjednoczony przez migrenê i silne rz¹dy.;La región de origen del Buda ya no debe temer a la guerra y la inestabilidad, ya que ha estado unida por una gobernación fuerte y migratoria.;La regione natale del Buddha non dovrebbe più temere la guerra e l'instabilità, perché è stata unita da un governo forte e mellifluo.;A Buddha lakóhelye többé nem szabad félnie a háborútól és az instabilitástól, mert egy könyörtelen és erõs uralkodás egyesült.;Domovská oblast Buddhy by se u nemìla bát války a nestability, nebo byla sjednocena bohatou a silnou vládou.;A Buddha lakóhelye többé nem szabad félnie a háborútól és az instabilitástól, mert egy könyörtelen és erõs uralkodás egyesült.;De thuisregio van de Boeddha zou niet langer oorlog en instabiliteit moeten vrezen, want het is verenigd door een migthy en een sterke heerschappij.;A região natal do Buda não deve mais temer a guerra e a instabilidade, pois foi unida por um governo poderoso e forte.;Äîìàøíèé ğåãèîí Áóääû áîëüøå íå äîëæåí áîÿòüñÿ âîéíû è íåñòàáèëüíîñòè, ïîñêîëüêó åå îáúåäèíÿåò ìèãğèğóşùàÿ è ñèëüíàÿ âëàñòü.;Buddhan kotiseutu ei enää pelkää sotaa ja epävakautta, sillä se on yhdistynyt vaeltava ja vahva hallitsija.;x
form_persia_title;Form the Persian Empire;Former l'Empire perse;Bildung des Persischen Reiches;Zbuduj imperium perskie;Forma el Imperio Persa;Formare l'Impero Persiano;Formálja a Perzsa Birodalmat;Vytvoøení Perské Øíše;Formálja a Perzsa Birodalmat;Vorm het Perzische rijk;Forme o Império Persa;Ôîğìèğóéòå Ïåğñèäñêóş èìïåğèş;Muodosta Persian valtakunta;x
form_persia_desc;The Empire who was subjugated by Alexander, who fought the Romans, and who fell to the Arabs, it should no longer fear such foreign domination, for a strong Emperor has been found!;L'Empire subjugué par Alexandre, qui a combattu les Romains et qui est tombé aux mains des Arabes, ne devrait plus craindre une telle domination étrangère, car un puissant Empereur a été trouvé!;Das Reich, das von Alexander unterworfen wurde, der die Römer bekämpfte, und der den Arabern fiel, sollte eine solche Fremdherrschaft nicht länger fürchten, denn ein starker Kaiser wurde gefunden!;Imperium, które zosta³o podbite przez Aleksandra, który walczy³ z Rzymianami, i które pad³o ofiar¹ Arabów, nie powinno ju¿ d³u¿ej obawiaæ siê takiej obcej dominacji, poniewa¿ znaleziono silnego Imperatora!;¡El Imperio que fue subyugado por Alejandro, que luchó contra los romanos y cayó en manos de los árabes, ya no debería temer a la dominación extranjera, ya que se ha encontrado un emperador fuerte!;L'Impero che fu soggiogato da Alessandro, che combatté i Romani e che cadde sotto gli arabi, non dovrebbe più temere una tale dominazione straniera, perché è stato trovato un forte Imperatore!;A birodalom, akit Sándor leigázott, aki a rómaiak ellen harcolt, és aki az arabokba esett, nem szabad többé félnie az ilyen idegen uralomtól, mert egy erõs császárt találtak!;Øíši, která podmanila Alexandr, která bojovala proti Øímanùm a která padla Arabùm, u by se nemìla bát takové cizí nadvlády, protoe byl nalezen silnı císaø!;A birodalom, akit Sándor leigázott, aki a rómaiak ellen harcolt, és aki az arabokba esett, nem szabad többé félnie az ilyen idegen uralomtól, mert egy erõs császárt találtak!;Het rijk dat werd onderworpen door Alexander, die tegen de Romeinen vocht, en die viel voor de Arabieren, het zou niet langer bang zijn voor een dergelijke buitenlandse overheersing, want er is een sterke keizer gevonden!;O Império que foi subjugado por Alexandre, que lutou contra os romanos, e que caiu para os árabes, não deveria mais temer tal dominação estrangeira, pois um forte imperador foi encontrado!;Èìïåğèÿ, êîòîğàÿ áûëà ïîä÷èíåíà Àëåêñàíäğó, êîòîğûé âîåâàë ñ ğèìëÿíàìè, è êîòîğûé óïàë íà àğàáîâ, áîëüøå íå äîëæåí áûë îïàñàòüñÿ òàêîãî èíîñòğàííîãî ãîñïîäñòâà, ïîòîìó ÷òî áûë íàéäåí ñèëüíûé Èìïåğàòîğ!;Imperiumi, joka Aleksanteri oli alistanut, joka taisteli roomalaisia vastaan ja joka kaatui arabeihin, ei enää pidä pelätä tällaista ulkomaista ylivaltaa, sillä vahva keisari on löydetty!;x
form_kurdistan_title;The Homeland of the Kurds;La patrie des Kurdes;Das Heimatland der Kurden;Ojczyzna Kurdów;La patria de los kurdos;La patria dei curdi;A kurdok hazája;Královská vlas;A kurdok hazája;Het thuisland van de Koerden;A pátria dos curdos;Ğîäèíà êóğäîâ;Kurdien kotimaa;x
form_kurdistan_desc;Sons of Corduene, it has come the time for our nation to fight together against the foreign Arabs and Persians who just think of us as their slaves.;Fils de Gordyène, il est temps pour notre nation de se battre ensemble contre les Arabes et les Perses étrangers qui ne pensent à nous que comme leurs esclaves.;Söhne von Korduene, es ist die Zeit gekommen, dass unsere Nation gegen die fremden Araber und Perser, die uns einfach für ihre Sklaven halten, gemeinsam kämpfen muss.;Synowie Corduene, nadszed³ czas, aby nasz naród walczy³ razem przeciwko obcym Arabom i Persom, którzy uwa¿aj¹ nas za swoich niewolników.;Hijos de Corduene, ha llegado el momento de que nuestra nación luche en contra de los árabes y persas extranjeros que solo piensan en nosotros como sus esclavos.;Figli di Corduene, è giunto il momento per la nostra nazione di combattere insieme contro gli stranieri arabi e persiani che pensano a noi come a degli schiavi!;A Corduene fiai, eljött az ideje annak, hogy nemzetünk együtt harcoljon az idegen arabok és persák ellen, akik csak rabszolgáikra gondolnak ránk.;Synové z Corduene, pøišlo èas, aby náš národ bojoval proti cizím Arabùm a Peršanùm, kteøí o nás povaují za své otroky.;A Corduene fiai, eljött az ideje annak, hogy nemzetünk együtt harcoljon az idegen arabok és persák ellen, akik csak rabszolgáikra gondolnak ránk.;Zonen van Corduene, het is de tijd gekomen dat onze natie samen vecht tegen de buitenlandse Arabieren en Perzen die ons gewoon als hun slaven beschouwen.;Filhos de Corduene, chegou a hora de nossa nação lutar juntos contra os árabes e persas estrangeiros que só pensam em nós como escravos.;Ñûíîâüÿ Êîğäóıíà, íàñòàëî âğåìÿ äëÿ íàøåé íàöèè ñğàæàòüñÿ âìåñòå ñ èíîñòğàííûìè àğàáàìè è ïåğñàìè, êîòîğûå ïğîñòî äóìàşò î íàñ êàê î ñâîèõ ğàáàõ.;Corduenen poikien, on tullut aika meidän kansallemme taistella yhdessä ulkomaisten arabien ja persialaisten kanssa, jotka ajattelevat meitä vain orjina.;x
form_burma_title;$COUNTRY$, kings of the Burmese;$COUNTRY$, rois des Birmans;$COUNTRY$, Könige der Burmesen;$COUNTRY$, królowie Birmy;$COUNTRY$, reyes de los birmanos;$COUNTRY$, re dei birmani;$COUNTRY$, a burmai királyok;$COUNTRY$, králové barmského;$COUNTRY$, a burmai királyok;$COUNTRY$, kings of the Burmese;$COUNTRY$, reis do birmanês;$COUNTRY$, êîğîëè áèğìàíñêèõ;$COUNTRY$, Burman kuninkaat;x
