KEY;ENGLISH;FRENCH;GERMAN;POLISH;SPANISH;ITALIAN;HUNGARIAN;CZECH;HUNGARIAN;DUTCH;PORTUGUESE;RUSSIAN;FINNISH;X
nogovernment_desc;After the disaster of $YEAR$, when our government mysteriously disappeared, the Army has seized $COUNTRY$ and ended the period of anarchy.;Après le désastre de $YEAR$, lorsque notre gouvernement a mystérieusement disparu, l'armée a saisi $COUNTRY$ et mis fin à la période d'anarchie.;Nach der Katastrophe von $YEAR$, als unsere Regierung auf mysteriöse Weise verschwand, hat die Armee $COUNTRY$ erobert und die Periode der Anarchie beendet.;Po katastrofie w $YEAR$ r., Kiedy nasz rz¹d w tajemniczy sposób znikn¹³, armia przejê³a $COUNTRY$ i zakoñczy³a okres anarchii.;Después del desastre de $YEAR$, cuando nuestro gobierno desapareció misteriosamente, el Ejército tomó $COUNTRY$ y terminó el período de anarquía.;Dopo il disastro del $YEAR$, quando il nostro governo scomparve misteriosamente, l'esercito si impadronì di $COUNTRY$ e pose fine al periodo di anarchia.;Az $YEAR$-es katasztrófa után, amikor a mi kormányunk titokzatosan eltûnt, a hadsereg megragadta a $COUNTRY$ -t és megszüntette az anarchia idõszakát.;Po katastrofì v roce $YEAR$, kdy naše vláda záhadnì zmizela, se armáda zmocnila $COUNTRY$ a ukonèila období anarchie.;Az $YEAR$-es katasztrófa után, amikor a mi kormányunk titokzatosan eltûnt, a hadsereg megragadta a $COUNTRY$ -t és megszüntette az anarchia idõszakát.;Após o desastre de $YEAR$, quando nosso governo desapareceu misteriosamente, o Exército apreendeu $COUNTRY$ e encerrou o período de anarquia.;Após o desastre de $YEAR$, quando nosso governo desapareceu misteriosamente, o Exército apreendeu $COUNTRY$ e encerrou o período de anarquia.;Ïîñëå êàòàñòğîôû $YEAR$ ãîäà, êîãäà íàøå ïğàâèòåëüñòâî òàèíñòâåííûì îáğàçîì èñ÷åçëî, àğìèÿ çàõâàòèëà $COUNTRY$ è çàêîí÷èëà ïåğèîä àíàğõèè.;Vuoden $YEAR$ katastrofin jälkeen, kun hallitus hävisi salaperäisesti, armeija on takavarikoinut $COUNTRY$ ja päättynyt anarkian ajan.;x
NOWARTITLE;Friends without Foes;Amis sans ennemis;Freunde ohne Feinde;Przyjaciele bez wrogów;Amigos sin enemigos;Amici senza nemici;Barátok ellenségek nélkül;Pøátelé bez nepøátel;Barátok ellenségek nélkül;Vrienden zonder vijanden;Amigos sem inimigos;Äğóçüÿ áåç âğàãîâ;Ystävät ilman vihollisia;x
NOWARDESC;$COUNTRY$, lacking any recognition, territory and even army, is, by the mere absence of a peace treaty, involved in a war. Obviously there must be an error, which will be prompty solved.;$COUNTRY$, dépourvu de reconnaissance, de territoire et même d'armée, est, par la simple absence d'un traité de paix, impliqué dans une guerre. Évidemment, il doit y avoir une erreur, qui sera résolue à vide.;$COUNTRY$, dem es an Anerkennung, Territorium und sogar an Armee mangelt, ist durch das bloße Fehlen eines Friedensvertrages in einen Krieg verwickelt. Offensichtlich muss ein Fehler vorliegen, der umgehend behoben wird.;$COUNTRY$, pozbawiony jakiegokolwiek uznania, terytorium, a nawet armii, przez sam brak traktatu pokojowego bierze udzia³ w wojnie. Oczywiœcie musi wyst¹piæ b³¹d, który zostanie natychmiast rozwi¹zany.;$COUNTRY$, que carece de reconocimiento, territorio e incluso ejército, es, por la simple ausencia de un tratado de paz, involucrado en una guerra. Obviamente debe haber un error, que será resuelto rápidamente.;$COUNTRY$, privo di qualsiasi riconoscimento, territorio e perfino esercito, è, per la semplice assenza di un trattato di pace, coinvolto in una guerra. Ovviamente ci deve essere un errore, che sarà prontamente risolto.;A $COUNTRY$, amely nem ismeri el sem a területet, sem pedig a sereget, pusztán a békeszerzõdés hiányában háborúban vesz részt. Nyilvánvalónak kell lennie egy hibának, amely azonnal megoldásra kerül.;$COUNTRY$, postrádající jakékoli uznání, teritorium a dokonce i armádu, je pouhou absencí mírové smlouvy zapojena do války. Je zøejmé, e musí existovat chyba, která bude rychle vyøešena.;A $COUNTRY$, amely nem ismeri el sem a területet, sem pedig a sereget, pusztán a békeszerzõdés hiányában háborúban vesz részt. Nyilvánvalónak kell lennie egy hibának, amely azonnal megoldásra kerül.;$COUNTRY$, zonder enige erkenning, territorium en zelfs leger, is, door het ontbreken van een vredesverdrag, betrokken bij een oorlog. Het is duidelijk dat er een fout moet zijn, die snel zal worden opgelost.;$COUNTRY$, sem reconhecimento, território e até exército, é, pela mera ausência de um tratado de paz, envolvido em uma guerra. Obviamente, deve haver um erro, que será resolvido rapidamente.;$COUNTRY$, ëèøåííàÿ êàêîãî-ëèáî ïğèçíàíèÿ, òåğğèòîğèè è äàæå àğìèè, ïğîñòî èç-çà îòñóòñòâèÿ ìèğíîãî äîãîâîğà ó÷àñòâóåò â âîéíå. Î÷åâèäíî, äîëæíà áûòü îøèáêà, êîòîğàÿ áóäåò áûñòğî ğåøåíà.;$COUNTRY$, jolla ei ole tunnustusta, aluetta ja jopa armeijaa, on sotana mukana pelkästään rauhansopimuksen puuttuessa. Ilmeisesti on oltava virhe, joka nopeasti ratkaistaan.;x
NOWAROPTA;Where is my pen?;Où est mon stylo?;Wo ist mein Stift?;Gdzie jest mój d³ugopis?;¿Dónde está mi lapicero?;Dov'è la mia penna?;Hol van a tollam?;Kde je moje pero?;Hol van a tollam?;Waar is mijn pen?;Onde está a minha caneta?;Ãäå ìîÿ ğó÷êà?;Missä kynäni on?;x
form_czech_republic_title;Form $CULTURE_GROUP_UNION$;Formation de $CULTURE_GROUP_UNION$;$CULTURE_GROUP_UNION$ gründen;Utwórz: $CULTURE_GROUP_UNION$;Formar $CULTURE_GROUP_UNION$;Forma $CULTURE_GROUP_UNION$;;;;;Formar $CULTURE_GROUP_UNION$;Ñîçäàíèå äåğæàâû $CULTURE_GROUP_UNION$;;x
form_czech_republic_desc;Our dominant position among our cultural brethren puts us in a position to form $CULTURE_GROUP_UNION$.;Notre position dominante parmi nos frères culturels nous permet de former $CULTURE_GROUP_UNION$.;Unsere dominante Position unter unseren kulturellen Brüdern hat uns in die Position gebracht, $CULTURE_GROUP_UNION$ zu gründen.;Dominuj¹ca rola, jak¹ cieszymy siê w kontaktach z naszymi kulturowymi braæmi, pozwala nam stan¹æ na czele nowo utworzonego pañstwa o nazwie $CULTURE_GROUP_UNION$.;Nuestra posición dominante entre nuestros hermanos culturales nos coloca en posición de formar una nueva entidad: $CULTURE_GROUP_UNION$.;La posizione dominante che abbiamo tra i nostri fratelli culturali ci permette di formare $CULTURE_GROUP_UNION$.;;;;;Nossa posição dominante entre nossos irmãos culturais nos coloca em posição de formar $CULTURE_GROUP_UNION$.;Íàøå äîìèíèğóşùåå ïîëîæåíèå ñğåäè íàøèõ áğàòüåâ ïî êóëüòóğå ïîçâîëÿåò íàì ñôîğìèğîâàòü äåğæàâó $CULTURE_GROUP_UNION$.;;x
oy_vey_title;The Construction of the Third Temple;La construction du troisième temple;Der Bau des dritten Tempels;Budowa trzeciej œwi¹tyni;La construcción del tercer templo;La costruzione del terzo tempio;A harmadik templom építése;Stavba tøetího chrámu;A harmadik templom építése;De bouw van de derde tempel;A construção do terceiro templo;Ñòğîèòåëüñòâî Òğåòüåãî Õğàìà;Kolmannen temppelin rakentaminen;x
oy_vey_desc;Build the Third Temple in $CAPITAL$ and turn $COUNTRY$ into Israel, ruled by the $MONARCHTITLE$ David ben Shlomo;Construisez le troisième temple en $CAPITAL$ et transformez $COUNTRY$ en Israël, dirigé par le $MONARCHTITLE$ David ben Shlomo;Baue den dritten Tempel in $CAPITAL$ und verwandle $COUNTRY$ in Israel, das vom $MONARCHTITLE$ David ben Shlomo regiert wird;Zbuduj Trzeci¹ Œwi¹tyniê w $CAPITAL$ i zamieñ $COUNTRY$ w Izrael, rz¹dzony przez $MONARCHTITLE$ David ben Shlomo;Construye el Tercer Templo en $CAPITAL$ y convierte $COUNTRY$ en Israel, regido por el $MONARCHTITLE$ David ben Shlomo;Costruisci il Terzo Tempio in $CAPITAL$ e trasforma $COUNTRY$ in Israele, governato dal $MONARCHTITLE$ David ben Shlomo;Építsd meg a harmadik templomot a $CAPITAL$ban, és fordítsd a $COUNTRY$ot Izraelre, amelyet a $MONARCHTITLE$ David Ben Shlomo irányít.;Postavte tøetí chrám v $CAPITAL$ a promìòte $COUNTRY$ v Izrael, vládl $MONARCHTITLE$ David ben Shlomo;Építsd meg a harmadik templomot a $CAPITAL$ban, és fordítsd a $COUNTRY$ot Izraelre, amelyet a $MONARCHTITLE$ David Ben Shlomo irányít.;Bouw de derde tempel in $CAPITAL$ en verander $COUNTRY$ in Israël, geregeerd door de $MONARCHTITLE$ David ben Shlomo;Construa o Terceiro Templo em $CAPITAL$ e transforme $COUNTRY$ em Israel, governado pelo $MONARCHTITLE$ David ben Shlomo;Ïîñòğîéòå òğåòèé õğàì â $CAPITAL$ è ïğåâğàòèòå $COUNTRY$ â Èçğàèëü, êîòîğûì óïğàâëÿåò $MONARCHTITLE$ David ben Shlomo;Rakenna kolmas temppeli hintaan $CAPITAL$ ja käännä $COUNTRY$ Israeliksi, jota hallitsee $MONARCHTITLE$ David ben Shlomo;x
jew_NEWS;On $DATE_LONG_1$, $TAG_0_0_ADJ$ build the Third Temple. A priest from $ANYPROVINCE$ claims this is a sign of the end of times.;Le $DATE_LONG_1$, $TAG_0_0_ADJ$ construisez le troisième temple. Un prêtre de $ANYPROVINCE$ affirme que c'est un signe de la fin des temps.;Auf $DATE_LONG_1$ baut $TAG_0_0_ADJ$ den dritten Tempel. Ein Priester aus $ANYPROVINCE$ behauptet, dies sei ein Zeichen für das Ende der Zeiten.;W dniu $DATE_LONG_1$ $TAG_0_0_ADJ$ zbuduj Trzeci¹ Œwi¹tyniê. Kap³an z $ANYPROVINCE$ twierdzi, ¿e jest to znak koñca czasów.;El $DATE_LONG_1$, $TAG_0_0_ADJ$ construye el Tercer Templo. Un sacerdote de $ANYPROVINCE$ afirma que esto es una señal del fin de los tiempos.;Il $DATE_LONG_1$, $TAG_0_0_ADJ$ costruisce il Terzo Tempio. Un prete di $ANYPROVINCE$ afferma che questo è un segno della fine dei tempi.;$DATE_LONG_1$, $TAG_0_0_ADJ$ felépíti a harmadik templomot. A $ANYPROVINCE$ pap azt állítja, hogy ez az idõk vége jele.;$DATE_LONG_1$, $TAG_0_0_ADJ$ postaví tøetí chrám. Knìz z $ANYPROVINCE$ tvrdí, e je to znamení konce èasù.;$DATE_LONG_1$, $TAG_0_0_ADJ$ felépíti a harmadik templomot. A $ANYPROVINCE$ pap azt állítja, hogy ez az idõk vége jele.;Op $DATE_LONG_1$ bouwt $TAG_0_0_ADJ$ de derde tempel. Een priester van $ANYPROVINCE$ beweert dat dit een teken is van het einde der tijden.;Em $DATE_LONG_1$, $TAG_0_0_ADJ$ construa o Terceiro Templo. Um padre de $ANYPROVINCE$ afirma que este é um sinal do fim dos tempos.;Íà $DATE_LONG_1$ $TAG_0_0_ADJ$ ñîçäàéòå Òğåòèé Õğàì. Ñâÿùåííèê èç $ANYPROVINCE$ óòâåğæäàåò, ÷òî ıòî çíàê êîíöà âğåìåí.;$DATE_LONG_1$, $TAG_0_0_ADJ$ rakentaa kolmannen temppelin. Pappi $ANYPROVINCE$ väittää, että tämä on merkki aikojen lopusta.;x
japanese_names_in_korea_title;The $COUNTRY_ADJ$ State of Korea;L'État $COUNTRY_ADJ$ de la Corée;Der $COUNTRY_ADJ$e Staat Korea;$COUNTRY_ADJ$ Korea Po³udniowa;El Estado $COUNTRY_ADJ$ de Corea;Lo stato della Corea $COUNTRY_ADJ$;A (z) $COUNTRY_ADJ$ Korea állam;Korejskı stát $COUNTRY_ADJ$;A (z) $COUNTRY_ADJ$ Korea állam;De $COUNTRY_ADJ$ staat van Korea;O estado da Coreia $COUNTRY_ADJ$;$COUNTRY_ADJ$ Øòàò Êîğåÿ;$COUNTRY_ADJ$ Korean osavaltio;x
japanese_names_in_korea_desc;As we have finally conquered the Korean peninsula, we hold enough prestige to have the foreign barbarians translate the names of the cities according to our language rather than from Korean.;Comme nous avons enfin conquis la péninsule coréenne, nous avons suffisamment de prestige pour que les barbares étrangers traduisent les noms des villes en fonction de notre langue plutôt qu'en coréen.;Als wir endlich die koreanische Halbinsel erobert haben, haben wir genug Prestige, um die ausländischen Barbaren die Namen der Städte nach unserer Sprache und nicht nach Koreanisch übersetzen zu lassen.;Gdy w koñcu podbiliœmy Pó³wysep Koreañski, mamy wystarczaj¹cy presti¿, aby zagraniczni barbarzyñcy t³umaczyli nazwy miast wed³ug naszego jêzyka, a nie z koreañskiego.;Como finalmente hemos conquistado la península coreana, tenemos el prestigio suficiente para que los bárbaros extranjeros traduzcan los nombres de las ciudades de acuerdo con nuestro idioma en lugar del coreano.;Dato che alla fine abbiamo conquistato la penisola coreana, abbiamo abbastanza prestigio da permettere ai barbari stranieri di tradurre i nomi delle città secondo la nostra lingua piuttosto che dal coreano.;Ahogy végül meghódítottuk a Koreai-félszigetet, elegendõ presztízsünk van ahhoz, hogy a külföldi barbárok a városok nevét nyelvünk szerint fordítsák le, nem pedig koreaiul.;Kdy jsme koneènì dobyli korejskı poloostrov, máme dostateènou presti, aby zahranièní barbaøi mohli pøeloit názvy mìst podle našeho jazyka místo z korejštiny.;Ahogy végül meghódítottuk a Koreai-félszigetet, elegendõ presztízsünk van ahhoz, hogy a külföldi barbárok a városok nevét nyelvünk szerint fordítsák le, nem pedig koreaiul.;Nu we eindelijk het Koreaanse schiereiland hebben veroverd, hebben we genoeg prestige om de buitenlandse barbaren de namen van de steden naar onze taal te laten vertalen in plaats van naar het Koreaans.;Como finalmente conquistamos a península coreana, temos prestígio suficiente para que os bárbaros estrangeiros traduzam os nomes das cidades de acordo com a nossa língua e não do coreano.;Ïîñêîëüêó ìû íàêîíåö çàâîåâàëè Êîğåéñêèé ïîëóîñòğîâ, ìû îáëàäàåì äîñòàòî÷íûì àâòîğèòåòîì, ÷òîáû èíîñòğàííûå âàğâàğû ïåğåâîäèëè íàçâàíèÿ ãîğîäîâ â ñîîòâåòñòâèè ñ íàøèì ÿçûêîì, à íå ñ êîğåéñêîãî.;Kun olemme lopulta valloittaneet Korean niemimaan, meillä on tarpeeksi arvovaltaa, jotta ulkomaiset barbaarit kääntävät kaupunkien nimet kielemme mukaan eikä koreaksi.;x
restore_korea_title;A Korea for Koreans;Une Corée pour les Coréens;Ein Korea für Koreaner;Korea dla Koreañczyków;Una Corea para los coreanos;Una Corea per i coreani;Korea a koreaiak számára;Korea pro Korejce;Korea a koreaiak számára;Een Korea voor Koreanen;Uma Coréia para coreanos;Êîğåÿ äëÿ êîğåéöåâ;Korea korealaisille;x
restore_korea_desc;After removing the foreign yoke on our land, the officers of $CAPITAL$ is pressing to have it recognized by the foreign barbarians. This means that they will have to rename our cities accordingly.;Après avoir enlevé le joug étranger sur nos terres, les officiers de $CAPITAL$ font pression pour le faire reconnaître par les barbares étrangers. Cela signifie qu'ils devront renommer nos villes en conséquence.;Nachdem die Beamten von $CAPITAL$ das ausländische Joch auf unserem Land entfernt haben, drängen sie darauf, dass es von den ausländischen Barbaren anerkannt wird. Dies bedeutet, dass sie unsere Städte entsprechend umbenennen müssen.;Po usuniêciu obcego jarzma na naszej ziemi, oficerowie $CAPITAL$ naciskaj¹, aby zosta³ uznany przez obcych barbarzyñców. Oznacza to, ¿e bêd¹ musieli odpowiednio zmieniæ nazwy naszych miast.;Después de retirar el yugo extranjero en nuestra tierra, los oficiales de $CAPITAL$ están presionando para que los bárbaros extranjeros lo reconozcan. Esto significa que tendrán que cambiar el nombre de nuestras ciudades en consecuencia.;Dopo aver rimosso il giogo straniero sulla nostra terra, gli ufficiali di $CAPITAL$ stanno premendo per farlo riconoscere dai barbari stranieri. Ciò significa che dovranno rinominare le nostre città di conseguenza.;Miután eltávolítottuk a külföldi igát a szárazföldünkrõl, a $CAPITAL$ tisztjei sürgetik, hogy ezt felismerjék a külföldi barbárok. Ez azt jelenti, hogy ennek megfelelõen át kell nevezniük városunkat.;Poté, co odstranili cizí jho na naší zemi, dùstojníci $CAPITAL$ naléhají, aby to uznali cizí barbaøi. To znamená, e budou muset odpovídajícím zpùsobem pøejmenovat naše mìsta.;Miután eltávolítottuk a külföldi igát a szárazföldünkrõl, a $CAPITAL$ tisztjei sürgetik, hogy ezt felismerjék a külföldi barbárok. Ez azt jelenti, hogy ennek megfelelõen át kell nevezniük városunkat.;Na het verwijderen van het buitenlandse juk op ons land, dringen de officieren van $CAPITAL$ erop om het door de buitenlandse barbaren te laten erkennen. Dit betekent dat ze onze steden dienovereenkomstig moeten hernoemen.;Depois de remover o jugo estrangeiro em nossa terra, os oficiais da $CAPITAL$ pressionam para que seja reconhecido pelos bárbaros estrangeiros. Isso significa que eles terão que renomear nossas cidades de acordo.;Ïîñëå óäàëåíèÿ èíîñòğàííîãî èãà íà íàøåé çåìëå îôèöåğû $CAPITAL$ íàñòàèâàşò íà òîì, ÷òîáû åãî óçíàëè èíîñòğàííûå âàğâàğû. İòî îçíà÷àåò, ÷òî èì ïğèäåòñÿ ñîîòâåòñòâåííî ïåğåèìåíîâàòü íàøè ãîğîäà.;Poistamisensa jälkeen ulkomaisen ikeen maapallolta, $CAPITAL$: n upseerit vaativat saadakseen ulkomaiset barbaarit tunnustamaan sen. Tämä tarkoittaa, että heidän on nimettävä kaupunkimme uudelleen vastaavasti.;x
chinese_names_in_korea_title;The $COUNTRY_ADJ$ State of Korea;L'État $COUNTRY_ADJ$ de la Corée;Der $COUNTRY_ADJ$e Staat Korea;$COUNTRY_ADJ$ Korea Po³udniowa;El Estado $COUNTRY_ADJ$ de Corea;Lo stato della Corea $COUNTRY_ADJ$;A (z) $COUNTRY_ADJ$ Korea állam;Korejskı stát $COUNTRY_ADJ$;A (z) $COUNTRY_ADJ$ Korea állam;De $COUNTRY_ADJ$ staat van Korea;O estado da Coreia $COUNTRY_ADJ$;$COUNTRY_ADJ$ Øòàò Êîğåÿ;$COUNTRY_ADJ$ Korean osavaltio;x
chinese_names_in_korea_desc;As we have finally conquered the Korean peninsula, we hold enough prestige to have the foreign barbarians translate the names of the cities according to our language rather than from Korean.;Comme nous avons enfin conquis la péninsule coréenne, nous avons suffisamment de prestige pour que les barbares étrangers traduisent les noms des villes en fonction de notre langue plutôt qu'en coréen.;Als wir endlich die koreanische Halbinsel erobert haben, haben wir genug Prestige, um die ausländischen Barbaren die Namen der Städte nach unserer Sprache und nicht nach Koreanisch übersetzen zu lassen.;Gdy w koñcu podbiliœmy Pó³wysep Koreañski, mamy wystarczaj¹cy presti¿, aby zagraniczni barbarzyñcy t³umaczyli nazwy miast wed³ug naszego jêzyka, a nie z koreañskiego.;Como finalmente hemos conquistado la península coreana, tenemos el prestigio suficiente para que los bárbaros extranjeros traduzcan los nombres de las ciudades de acuerdo con nuestro idioma en lugar del coreano.;Dato che alla fine abbiamo conquistato la penisola coreana, abbiamo abbastanza prestigio da permettere ai barbari stranieri di tradurre i nomi delle città secondo la nostra lingua piuttosto che dal coreano.;Ahogy végül meghódítottuk a Koreai-félszigetet, elegendõ presztízsünk van ahhoz, hogy a külföldi barbárok a városok nevét nyelvünk szerint fordítsák le, nem pedig koreaiul.;Kdy jsme koneènì dobyli korejskı poloostrov, máme dostateènou presti, aby zahranièní barbaøi mohli pøeloit názvy mìst podle našeho jazyka místo z korejštiny.;Ahogy végül meghódítottuk a Koreai-félszigetet, elegendõ presztízsünk van ahhoz, hogy a külföldi barbárok a városok nevét nyelvünk szerint fordítsák le, nem pedig koreaiul.;Nu we eindelijk het Koreaanse schiereiland hebben veroverd, hebben we genoeg prestige om de buitenlandse barbaren de namen van de steden naar onze taal te laten vertalen in plaats van naar het Koreaans.;Como finalmente conquistamos a península coreana, temos prestígio suficiente para que os bárbaros estrangeiros traduzam os nomes das cidades de acordo com a nossa língua e não do coreano.;Ïîñêîëüêó ìû íàêîíåö çàâîåâàëè Êîğåéñêèé ïîëóîñòğîâ, ìû îáëàäàåì äîñòàòî÷íûì àâòîğèòåòîì, ÷òîáû èíîñòğàííûå âàğâàğû ïåğåâîäèëè íàçâàíèÿ ãîğîäîâ â ñîîòâåòñòâèè ñ íàøèì ÿçûêîì, à íå ñ êîğåéñêîãî.;Kun olemme lopulta valloittaneet Korean niemimaan, meillä on tarpeeksi arvovaltaa, jotta ulkomaiset barbaarit kääntävät kaupunkien nimet kielemme mukaan eikä koreaksi.;x
qing_china_title;What is the Middle Kingdom?;Qu'est-ce que l'Empire du Milieu?;Was ist das Reich der Mitte?;Co to jest Pañstwo Œrodka?;¿Qué es el Reino Medio?;Cos'è il Regno di Mezzo?;Mi a Közép Királyság?;Co je Støední øíše?;Mi a Közép Királyság?;Wat is het Middenrijk?;O que é o Reino do Meio?;×òî òàêîå Ïîäíåáåñíàÿ?;Mikä on keskimmäinen valtakunta?;x
qing_china_desc;Can a Manchu man be a Chinese? Why can only the Han consider themselves Chinese? This is nonsense, for the Middle Kingdom is in the hands of $COUNTRY$. It logically follows that we are China.;Un homme mandchou peut-il être chinois? Pourquoi seuls les Han peuvent-ils se considérer chinois? C'est absurde, car l'Empire du Milieu est entre les mains de $COUNTRY$. Il s'ensuit logiquement que nous sommes la Chine.;Kann ein Mandschu-Mann ein Chinese sein? Warum können sich nur die Han als Chinesen betrachten? Das ist Unsinn, denn das Reich der Mitte liegt in den Händen von $COUNTRY$. Daraus folgt logischerweise, dass wir China sind.;Czy cz³owiek mand¿urski mo¿e byæ Chiñczykiem? Dlaczego tylko Hanowie mog¹ uwa¿aæ siê za Chiñczyków? To nonsens, poniewa¿ Pañstwo Œrodka jest w rêkach $COUNTRY$. Logicznie wynika z tego, ¿e jesteœmy Chinami.;¿Puede un hombre manchú ser chino? ¿Por qué solo los Han pueden considerarse chinos? Esto es una tontería, porque el Reino Medio está en manos de $COUNTRY$. De ello se deduce lógicamente que somos China.;Può un uomo manciù essere cinese? Perché solo gli Han possono considerarsi cinesi? Questa è una sciocchezza, perché il Regno di Mezzo è nelle mani de $COUNTRY$. Ne consegue logicamente che siamo la Cina.;Lehet egy mandzsu férfi kínai? Miért csak hannak tekinthetik magukat kínaiaknak? Ez hülyeség, mert a Közép-Királyság $COUNTRY$ kezében van. Ebbõl logikusan következik, hogy mi vagyunk Kína.;Mùe bıt mu z Manchu Èíòanem? Proè se jen Èíòané mohou povaovat za Èíòany? To je nesmysl, protoe Støední øíše je v rukou $COUNTRY$. Z toho logicky vyplıvá, e jsme Èína.;Lehet egy mandzsu férfi kínai? Miért csak hannak tekinthetik magukat kínaiaknak? Ez hülyeség, mert a Közép-Királyság $COUNTRY$ kezében van. Ebbõl logikusan következik, hogy mi vagyunk Kína.;Kan een Manchu-man een Chinees zijn? Waarom kunnen alleen de Han zichzelf als Chinees beschouwen? Dit is onzin, want het Middenrijk is in handen van $COUNTRY$. Hieruit volgt logischerwijs dat we China zijn.;Um homem manchu pode ser chinês? Por que apenas os han podem se considerar chineses? Isso é um absurdo, pois o Reino do Meio está nas mãos de $COUNTRY$. Daí decorre que somos a China.;Ìîæåò ëè ìàíü÷æóğà áûòü êèòàéöåì? Ïî÷åìó òîëüêî õàíüöû ìîãóò ñ÷èòàòü ñåáÿ êèòàéöàìè? İòî ÷óøü, ïîòîìó ÷òî Ïîäíåáåñíàÿ íàõîäèòñÿ â ğóêàõ $COUNTRY$. Èç ıòîãî ëîãè÷íî ñëåäóåò, ÷òî ìû Êèòàé.;Voiko manchu-mies olla kiinalainen? Miksi vain hanit voivat pitää itseään kiinalaisina? Tämä on hölynpölyä, sillä Keskimmäinen on $COUNTRY$ käsissä. Loogisesti seuraa, että olemme Kiina.;x
form_celtic_title;Unite the Celts;Unir les Celtes;Vereinige die Kelten;Zjednocz Celtów;Unir a los celtas;Unisci i Celti;Egyesítsd a keltákat;Spojte Kelty;Egyesítsd a keltákat;Verenig de Kelten;Una os Celtas;Îáúåäèíèòå êåëüòîâ;Yhdistä keltit;x
